,user_input,response,reference,answer_relevancy,answer_correctness,semantic_similarity,bleu_score,rouge_score
57,What is CVE-2023-35748,"CVE-2023-35748 is a vulnerability identified in the Python packaging tool, pip. This security flaw allows an authenticated attacker to execute arbitrary code on the server by exploiting the ability to create ZIP files. It particularly affects users who are employing vulnerable versions of pip to install packages from untrusted sources. The severity of this issue warrants immediate attention, and users are strongly advised to upgrade to the patched version to mitigate the risk. Always ensure that trusted sources are used for package installation to minimize potential vulnerabilities.",D-Link DAP-2622 DDP Firmware Upgrade Server IPv6 Address Stack-based Buffer Overflow Remote Code Execution Vulnerability. This vulnerability allows network-adjacent attackers to execute arbitrary code on affected installations of D-Link DAP-2622 routers. Authentication is not required to exploit this vulnerability. The specific flaw exists within the DDP service. The issue results from the lack of proper validation of the length of user-supplied data prior to copying it to a fixed-length stack-based buffer. An attacker can leverage this vulnerability to execute code in the context of root. . Was ZDI-CAN-20076.,0.8809093214243929,0.20094073631691603,0.8037515294773185,0.07141816289329644,0.20408163265306123
58,What is CVE-2023-36431,"CVE-2023-36431 is a vulnerability identified in the Microsoft Windows operating system, specifically affecting the Windows Common Log File System (CLFS). This vulnerability allows an attacker to execute arbitrary code with elevated privileges, potentially leading to a complete system compromise. It is classified as a critical security issue, and Microsoft has released patches to address the vulnerability. Users and administrators are strongly advised to apply the updates promptly to mitigate the risk of exploitation. As with many vulnerabilities, timely patching is essential to protect systems from potential attacks.",Microsoft Message Queuing (MSMQ) Denial of Service Vulnerability,0.9190659496128206,0.32717997671099025,0.8092065028055169,0.01982256626710344,0.375
59,What is CVE-2023-36579,"CVE-2023-36579 is a vulnerability identified in the Microsoft Windows operating system, specifically affecting the Windows Common Log File System (CLFS). This vulnerability allows an attacker to execute arbitrary code with elevated privileges, potentially leading to a complete system compromise. It is classified as a critical security issue, and Microsoft has released patches to address the vulnerability. Users and administrators are strongly advised to apply the updates promptly to mitigate the risk of exploitation. As with many vulnerabilities, timely patching is essential to protect systems from potential attacks.",Microsoft Message Queuing (MSMQ) Denial of Service Vulnerability,0.9293676777035363,0.3272305011981833,0.8087342210005062,0.01982256626710344,0.375
60,What is CVE-2023-37291,"CVE-2023-37291 is a vulnerability affecting certain versions of the Atlassian Jira Software. It is classified as a potential security exposure that arises from improper input validation. The vulnerability could allow an attacker with specific privileges to execute arbitrary code or bypass security restrictions, potentially leading to unauthorized access to sensitive data. Atlassian released updates to address this vulnerability, and users are advised to upgrade to the latest versions of the software to mitigate risks. It's essential for organizations to regularly monitor for such vulnerabilities and apply patches promptly to safeguard their systems.",Galaxy Software Services Vitals ESP is vulnerable to using a hard-coded encryption key. An unauthenticated remote attacker can generate a valid token parameter and exploit this vulnerability to access system to operate processes and access data. This issue affects Vitals ESP: from 3.0.8 through 6.2.0.,0.8938105216131335,0.2027381907378938,0.8109686299988978,0.04016138436407654,0.2
61,What is CVE-2023-37319,"CVE-2023-37319 is a vulnerability identified in the Microsoft Windows operating system, specifically affecting the Windows Common Log File System Driver. This vulnerability allows an attacker to execute arbitrary code with elevated privileges, potentially leading to a complete system compromise. It is classified as a critical security issue, and Microsoft has released patches to address the vulnerability. Users and administrators are strongly advised to apply the updates promptly to mitigate the risk of exploitation. As with many vulnerabilities, timely patching is essential to protect systems from potential attacks.",D-Link DAP-2622 DDP Set IPv6 Address Stack-based Buffer Overflow Remote Code Execution Vulnerability. This vulnerability allows network-adjacent attackers to execute arbitrary code on affected installations of D-Link DAP-2622 routers. Authentication is not required to exploit this vulnerability. The specific flaw exists within the DDP service. The issue results from the lack of proper validation of the length of user-supplied data prior to copying it to a fixed-length stack-based buffer. An attacker can leverage this vulnerability to execute code in the context of root. . Was ZDI-CAN-20097.,0.9089978048112232,0.1975071300384673,0.7901205477720442,0.04149855697139171,0.17708333333333334
62,What is CVE-2023-37822,"CVE-2023-37822 is a vulnerability identified in the Microsoft Windows operating system, specifically affecting the Windows Common Log File System Driver. This vulnerability allows an attacker to execute arbitrary code with elevated privileges, potentially leading to a complete system compromise. The issue arises from improper handling of objects in memory, which can be exploited through specially crafted applications. Microsoft has released patches to address this vulnerability, and users are strongly advised to update their systems to mitigate the risk. As with many vulnerabilities, timely application of security updates is crucial to protect against potential exploitation.","The Eufy Homebase 2 before firmware version 3.3.4.1h creates a dedicated wireless network for its ecosystem, which serves as a proxy to the end user's primary network. The WPA2-PSK generation of this dedicated network is flawed and solely based on the serial number. Due to the flawed generation process, the WPA2-PSK can be brute forced offline within seconds. This vulnerability allows an attacker in proximity to the dedicated wireless network to gain unauthorized access to the end user's primary network. The only requirement of the attack is proximity to the dedicated wireless network.",0.9208767023928113,0.18554023508744144,0.7425922418628162,0.02769348116298872,0.16
63,What is CVE-2023-39238,"CVE-2023-39238 is a vulnerability affecting certain versions of the OpenSSL library, specifically impacting its handling of elliptic curve operations. The issue arises from improper validation of inputs, which could allow an attacker to exploit this flaw to execute arbitrary code or cause a denial of service, depending on the context of the application using OpenSSL. This vulnerability has been classified as a high-severity issue due to its potential to affect a wide range of applications that rely on the library for secure communications. Users and developers are urged to update to patched versions of OpenSSL to mitigate the risks associated with this vulnerability. For the most current information, always refer to the official OpenSSL announcements or relevant security advisories.","It is identified a format string vulnerability in ASUS RT-AX56U V2. This vulnerability is caused by lacking validation for a specific value within its set_iperf3_svr.cgi module. A remote attacker with administrator privilege can exploit this vulnerability to perform remote arbitrary code execution, arbitrary system operation or disrupt service.",0.8992905727143606,0.20622279083901401,0.8248137792819368,0.025828020030551086,0.25
64,What is CVE-2023-3997,"CVE-2023-3997 is a vulnerability identified in the Linux kernel, specifically affecting the way the kernel handles certain operations. This vulnerability can lead to a privilege escalation, allowing an attacker to gain elevated permissions on affected systems. It has been assigned a CVSS score indicating a high severity level, which underscores the potential impact on system security. Users and administrators are advised to apply the latest patches and updates provided by their Linux distribution maintainers to mitigate the risks associated with this vulnerability. As always, monitoring security advisories and implementing best practices for system security is crucial.","Splunk SOAR versions lower than 6.1.0 are indirectly affected by a potential vulnerability accessed through the user’s terminal. A third party can send Splunk SOAR a maliciously crafted web request containing special ANSI characters to cause log file poisoning. When a terminal user attempts to view the poisoned logs, this can tamper with the terminal and cause possible malicious code execution from the terminal user’s action.",0.9092070614697695,0.20167771297780715,0.8067108519112286,0.028423265381137038,0.17142857142857143
65,What is CVE-2023-40495,"CVE-2023-40495 is a critical vulnerability identified in Microsoft Windows that allows attackers to bypass security features and execute arbitrary code. The flaw is associated with the Windows Win32k component, which handles user interface elements. Exploiting this vulnerability could lead to a full system compromise, especially if an attacker targets a user with administrative privileges. Microsoft has released security patches to address this issue, and it is highly recommended for users and administrators to update their systems promptly to mitigate potential risks. Further details and confirmation of exploitation in the wild have raised concerns among cybersecurity professionals, emphasizing the need for immediate action against this vulnerability.",LG Simple Editor copyTemplateAll Directory Traversal Information Disclosure Vulnerability. This vulnerability allows remote attackers to disclose sensitive information on affected installations of LG Simple Editor. Authentication is not required to exploit this vulnerability. The specific flaw exists within the copyTemplateAll method. The issue results from the lack of proper validation of a user-supplied path prior to using it in file operations. An attacker can leverage this vulnerability to disclose information in the context of SYSTEM. . Was ZDI-CAN-19922.,0.9313699153789518,0.1984117863492682,0.7936471453970728,0.04724932626401583,0.1875
66,What is CVE-2023-40511,"CVE-2023-40511 is a critical vulnerability affecting various versions of the Spring Framework that could allow for remote code execution. Discovered in August 2023, this vulnerability arises from improper handling of certain inputs, enabling attackers to execute arbitrary code on affected systems. Spring Framework users are recommended to update to patched versions immediately to mitigate potential exploitation. Additionally, organizations should review their security practices related to input validation and application configurations to further strengthen their defenses against such vulnerabilities. For the most accurate and detailed information, checking the official security advisories and updates from the Spring Framework team is advisable.",LG Simple Editor checkServer Authentication Bypass Vulnerability. This vulnerability allows remote attackers to bypass authentication on affected installations of LG Simple Editor. Authentication is not required to exploit this vulnerability. The specific flaw exists within the checkServer method. The issue results from the exposure of plaintext credentials. An attacker can leverage this vulnerability to bypass authentication on the system. . Was ZDI-CAN-20013.,0.9024326515452673,0.20024455680904057,0.8013208225526465,0.027156804039319287,0.2222222222222222
67,What is CVE-2023-42102,"CVE-2023-42102 is a vulnerability identified in the Apache HTTP Server, specifically affecting versions 2.4.0 to 2.4.54. This vulnerability allows for a potential denial-of-service (DoS) attack due to improper handling of certain requests, which could lead to server crashes or unresponsiveness. The issue arises from the server's failure to adequately validate input, making it susceptible to crafted requests that exploit this weakness. Users and administrators are advised to upgrade to the latest patched version of the Apache HTTP Server to mitigate the risk associated with this vulnerability. As always, it is recommended to monitor official security advisories for any updates or additional information regarding this CVE.","Ashlar-Vellum Cobalt AR File Parsing Type Confusion Remote Code Execution Vulnerability. This vulnerability allows remote attackers to execute arbitrary code on affected installations of Ashlar-Vellum Cobalt. User interaction is required to exploit this vulnerability in that the target must visit a malicious page or open a malicious file. The specific flaw exists within the parsing of AR files. The issue results from the lack of proper validation of user-supplied data, which can result in a type confusion condition. An attacker can leverage this vulnerability to execute code in the context of the current process. . Was ZDI-CAN-20409.",0.9032784722030196,0.1999186641881624,0.7997287004047307,0.049846888244961605,0.18811881188118812
68,What is CVE-2023-42481,"CVE-2023-42481 is a vulnerability identified in the Apache HTTP Server, specifically affecting versions 2.4.0 to 2.4.54. This vulnerability is classified as a security flaw that could allow an attacker to bypass security restrictions and potentially execute arbitrary code. The issue arises from improper handling of certain requests, which could lead to unauthorized access or data exposure. Users and administrators are strongly advised to update to the latest patched version of the Apache HTTP Server to mitigate the risks associated with this vulnerability. For detailed information, it is recommended to consult the official Apache security advisories or relevant CVE databases.","In SAP Commerce Cloud - versions HY_COM 1905, HY_COM 2005, HY_COM2105, HY_COM 2011, HY_COM 2205, COM_CLOUD 2211, a locked B2B user can misuse the forgotten password functionality to un-block his user account again and re-gain access if SAP Commerce Cloud - Composable Storefront is used as storefront, due to weak access controls in place. This leads to a considerable impact on confidentiality and integrity.",0.9024421621713626,0.19407943613690698,0.7763177445476279,0.03404699216018261,0.14285714285714285
69,What is CVE-2023-44437,"CVE-2023-44437 is a vulnerability identified in the Microsoft Dynamics 365 Business Central application. It is classified as a critical security issue that could allow an attacker to execute arbitrary code on the affected system. The vulnerability arises from improper validation of user input, which could be exploited through specially crafted requests. Microsoft has released patches to address this vulnerability, and users are strongly advised to update their systems to mitigate potential risks. As with any critical vulnerability, organizations should prioritize applying the updates to protect their data and systems from potential exploitation.",Ashlar-Vellum Cobalt Uncontrolled Search Path Element Remote Code Execution Vulnerability. This vulnerability allows remote attackers to execute arbitrary code on affected installations of Ashlar-Vellum Cobalt. User interaction is required to exploit this vulnerability in that the target must visit a malicious page or open a malicious file. The specific flaw exists within the parsing of various file types. The process loads a library from an unsecured location. An attacker can leverage this vulnerability to execute code in the context of the current process. . Was ZDI-CAN-21540.,0.932818198247182,0.2960631232369182,0.8092524929476727,0.06608973813188646,0.1797752808988764
70,What is CVE-2023-45246,"CVE-2023-45246 is a vulnerability identified in the Apache HTTP Server, specifically affecting versions prior to 2.4.57. This vulnerability is classified as a denial-of-service (DoS) issue, which can be exploited by an attacker to cause the server to become unresponsive. The flaw arises from improper handling of certain requests, leading to resource exhaustion. Users are advised to upgrade to the latest version of the Apache HTTP Server to mitigate the risk associated with this vulnerability. As always, it is recommended to review security advisories and apply patches promptly to maintain system security.","Sensitive information disclosure and manipulation due to missing authorization. The following products are affected: Acronis Cyber Protect Cloud Agent (Linux, macOS, Windows) before build 36343.",0.9010943778129672,0.19337225388013723,0.7734890155205489,0.02055847707468329,0.12
71,What is CVE-2023-46285,"CVE-2023-46285 is a vulnerability affecting the Google Chrome browser, specifically related to a use-after-free flaw in the WebRTC component. This security issue could allow an attacker to execute arbitrary code on the affected system by exploiting the vulnerability during a targeted attack, potentially leading to unauthorized data access or system compromise. Google has addressed this vulnerability with updates to Chrome, urging users to update to the latest version to mitigate any risks. The vulnerability has been labeled as high severity, reflecting the potential impact on users who do not apply the patches promptly. As with most security vulnerabilities, it is essential for users to remain vigilant and keep their software up to date to minimize exposure to such threats.","A vulnerability has been identified in Opcenter Execution Foundation (All versions < V2407), Opcenter Quality (All versions < V2312), SIMATIC PCS neo (All versions < V4.1), SINEC NMS (All versions < V2.0 SP1), Totally Integrated Automation Portal (TIA Portal) V14 (All versions), Totally Integrated Automation Portal (TIA Portal) V15.1 (All versions), Totally Integrated Automation Portal (TIA Portal) V16 (All versions), Totally Integrated Automation Portal (TIA Portal) V17 (All versions < V17 Update 8), Totally Integrated Automation Portal (TIA Portal) V18 (All versions < V18 Update 3). The affected application contains an improper input validation vulnerability that could allow an attacker to bring the service into a Denial-of-Service state by sending a specifically crafted message to 4004/tcp. The corresponding service is auto-restarted after the crash is detected by a watchdog.",0.9115924054546207,0.20202218080125275,0.8080339939515941,0.029916393762856205,0.12307692307692308
72,What is CVE-2023-48363,"CVE-2023-48363 is a vulnerability identified in the Apache HTTP Server, specifically affecting versions prior to 2.4.57. This flaw is categorized as a denial-of-service (DoS) vulnerability, which can be exploited by an attacker to cause the server to crash or become unresponsive. The issue arises from improper handling of certain requests, leading to resource exhaustion. Users are advised to upgrade to the latest version of the Apache HTTP Server to mitigate the risk associated with this vulnerability. As always, it's important to monitor official security advisories for any updates or additional information regarding this CVE.","A vulnerability has been identified in OpenPCS 7 V9.1 (All versions < V9.1 SP2 UC05), SIMATIC BATCH V9.1 (All versions < V9.1 SP2 UC05), SIMATIC PCS 7 V9.1 (All versions < V9.1 SP2 UC05), SIMATIC Route Control V9.1 (All versions < V9.1 SP2 UC05), SIMATIC WinCC Runtime Professional V18 (All versions < V18 Update 4), SIMATIC WinCC Runtime Professional V19 (All versions < V19 Update 2), SIMATIC WinCC V7.4 (All versions), SIMATIC WinCC V7.5 (All versions < V7.5 SP2 Update 15), SIMATIC WinCC V8.0 (All versions < V8.0 Update 4). The implementation of the RPC (Remote Procedure call) communication protocol in the affected products do not properly handle certain unorganized RPC messages. An attacker could use this vulnerability to cause a denial of service condition in the RPC server.",0.9005122706014531,0.9519896421219225,0.80795856848769,0.06809398432036522,0.11940298507462686
73,What is CVE-2023-49928,"CVE-2023-49928 is a vulnerability identified in the Apache HTTP Server, specifically affecting versions prior to 2.4.59. This vulnerability is classified as a denial-of-service (DoS) issue, which can be exploited by an attacker to cause the server to crash or become unresponsive. The flaw arises from improper handling of certain requests, leading to resource exhaustion. Users and administrators are advised to upgrade to the latest version of the Apache HTTP Server to mitigate the risk associated with this vulnerability. As always, it is recommended to review security advisories and apply patches promptly to maintain system security.","An issue was discovered in Samsung Mobile Processor, Wearable Processor, and Modem Exynos 980, Exynos 990, Exynos 850, Exynos 1080, Exynos 2100, Exynos 2200, Exynos 1280, Exynos 1380, Exynos 1330, Exynos 9110, Exynos W920, Exynos Modem 5123, Exynos Modem 5300. The baseband software does not properly check states specified by the RRC. This can lead to disclosure of sensitive information.",0.9029809625008479,0.18967726550532638,0.7587090620213055,0.028629993657668874,0.11666666666666667
74,What is CVE-2023-5123,"CVE-2023-5123 is a vulnerability identified in certain versions of the Linux kernel. It is a security issue that can allow local attackers to gain elevated privileges, potentially leading to privilege escalation. The vulnerability stems from improper handling of certain input in the kernel, allowing attackers to exploit it to execute arbitrary code with higher permissions. Patches addressing this vulnerability have been released by various Linux distributions, and users are advised to update their systems promptly to mitigate risks. As of the latest updates, it is important for system administrators to check for any available patches and implement them to secure their environments.","The JSON datasource plugin ( https://grafana.com/grafana/plugins/marcusolsson-json-datasource/ ) is a Grafana Labs maintained plugin for Grafana that allows for retrieving and processing JSON data from a remote endpoint (including a specific sub-path) configured by an administrator. Due to inadequate sanitization of the dashboard-supplied path parameter, it was possible to include path traversal characters (../) in the path parameter and send requests to paths on the configured endpoint outside the configured sub-path. This means that if the datasource was configured by an administrator to point at some sub-path of a domain (e.g. https://example.com/api/some_safe_api/ ), it was possible for an editor to create a dashboard referencing the datasource which issues queries containing path traversal characters, which would in turn cause the datasource to instead query arbitrary subpaths on the configured domain (e.g. https://example.com/api/admin_api/) . In the rare case that this plugin is configured by an administrator to point back at the Grafana instance itself, this vulnerability becomes considerably more severe, as an administrator browsing a maliciously configured panel could be compelled to make requests to Grafana administrative API endpoints with their credentials, resulting in the potential for privilege escalation, hence the high score for this vulnerability.",0.9160466804833899,0.1816524072047586,0.7266819865460901,0.08276380533331384,0.09905660377358491
75,What is CVE-2023-5393,"CVE-2023-5393 is a vulnerability identified in the Linux kernel, specifically affecting the way the kernel handles certain system calls. This flaw could allow an unprivileged user to escalate their privileges on the system, potentially leading to unauthorized access or control over sensitive data. The vulnerability has been assigned a high severity rating, and patches have been released to mitigate the risk. Users and administrators are strongly advised to update their systems to the latest kernel version to protect against potential exploitation. For detailed information, it is recommended to consult the official security advisories from the Linux kernel maintainers or relevant security organizations.",Server receiving a malformed message that causes a disconnect to a hostname may causing a stack overflow resulting in possible remote code execution. Honeywell recommends updating to the most recent version of the product. See Honeywell Security Notification for recommendations on upgrading and versioning.,0.9126721200225378,0.19464341790698825,0.778573671627953,0.023341187806527487,0.20454545454545456
76,What is CVE-2023-6022,"CVE-2023-6022 is a vulnerability identified in certain versions of the popular web framework FastAPI. This issue is classified as a security flaw that allows an attacker to execute a denial-of-service (DoS) attack by sending a specially crafted request. The vulnerability primarily arises from improper handling of specific inputs, leading to excessive resource consumption on the server. It is crucial for developers using FastAPI to update to the latest patched versions to mitigate the risk associated with this vulnerability and ensure the security of their applications. Always refer to the official security advisories and documentation for the most comprehensive and detailed information regarding the vulnerability.",Cross-Site Request Forgery (CSRF) in GitHub repository prefecthq/prefect prior to 2.16.5.,0.8843062136842939,0.203563955888275,0.8141947608551252,0.024455939372403628,0.13333333333333333
