,user_input,response,reference,answer_relevancy,answer_correctness,semantic_similarity,bleu_score,rouge_score
0,What is CVE-2013-3900,"CVE-2013-3900 is a vulnerability in Microsoft SharePoint that allows for elevation of privileges. It occurs because of improper validation of web requests, which could permit an attacker to execute arbitrary code on the server. The vulnerability affects various SharePoint versions, and successful exploitation could enable an attacker to take control of the affected system. Microsoft addressed this issue in their security updates, and users are encouraged to apply the latest patches to mitigate any risks associated with this vulnerability. Security best practices, such as regular updates and monitoring, are essential to protect against such vulnerabilities.","Why is Microsoft republishing a CVE from 2013? We are republishing CVE-2013-3900 in the Security Update Guide to update the Security Updates table and to inform customers that the EnableCertPaddingCheck is available in all currently supported versions of Windows 10 and Windows 11. While the format is different from the original CVE published in 2013, the information herein remains unchanged from the original text published on December 10, 2013. Microsoft does not plan to enforce the stricter verification behavior as a default functionality on supported releases of Microsoft Windows. This behavior remains available as an opt-in feature via reg key setting, and is available on supported editions of Windows released since December 10, 2013. This includes all currently supported versions of Windows 10 and Windows 11. The supporting code for this reg key was incorporated at the time of release for Windows 10 and Windows 11, so no security update is required; however, the reg key must be set. See the Security Updates table for the list of affected software. Vulnerability Description A remote code execution vulnerability exists in the way that the WinVerifyTrust function handles Windows Authenticode signature verification for portable executable (PE) files. An anonymous attacker could exploit the vulnerability by modifying an existing signed executable file to leverage unverified portions of the file in such a way as to add malicious code to the file without invalidating the signature. An attacker who successfully exploited this vulnerability could take complete control of an affected system. An attacker could then install programs; view, change, or delete data; or create new accounts with full user rights. If a user is logged on with administrative user rights, an attacker who successfully exploited this vulnerability could take complete control of an affected system. An attacker could then install programs; view, change, or delete data; or create new accounts with full user rights. Users whose accounts are configured to have fewer user rights on the system could be less impacted than users who operate with administrative user rights. Exploitation of this vulnerability requires that a user or application run or install a specially crafted, signed PE file. An attacker could modify an existing signed file to include malicious code without invalidating the signature. This code would... See more at https://msrc.microsoft.com/update-guide/vulnerability/CVE-2013-3900",0.8916761641219728,,0.8610116528639191,0.13536681105774234,0.08740359897172237
1,What is CVE-2019-1133,"CVE-2019-1133 is a vulnerability found in Microsoft Dynamics 365, specifically in the way the application handles remote procedure calls (RPC) in its Web client. This vulnerability allows an attacker to execute arbitrary code in the context of the user running the Dynamics 365 application, potentially leading to a full system compromise. The issue arises from improper validation of input. Microsoft addressed this vulnerability with a security update that mitigates the risk by improving the handling of RPC requests. Organizations using affected versions of Microsoft Dynamics 365 are strongly advised to apply the update to protect against potential exploitation.","A remote code execution vulnerability exists in the way that the scripting engine handles objects in memory in Internet Explorer. The vulnerability could corrupt memory in such a way that an attacker could execute arbitrary code in the context of the current user. An attacker who successfully exploited the vulnerability could gain the same user rights as the current user. If the current user is logged on with administrative user rights, an attacker who successfully exploited the vulnerability could take control of an affected system. An attacker could then install programs; view, change, or delete data; or create new accounts with full user rights. In a web-based attack scenario, an attacker could host a specially crafted website that is designed to exploit the vulnerability through Internet Explorer and then convince a user to view the website. An attacker could also embed an ActiveX control marked &quot;safe for initialization&quot; in an application or Microsoft Office document that hosts the IE rendering engine. The attacker could also take advantage of compromised websites and websites that accept or host user-provided content or advertisements. These websites could contain specially crafted content that could exploit the vulnerability. The security update addresses the vulnerability by modifying how the scripting engine handles objects in memory.",0.8884195600830468,,0.8545293650890639,0.07039774105336837,0.1509433962264151
2,What is CVE-2019-1155,"CVE-2019-1155 is a vulnerability affecting Microsoft Dynamics 365 (on-premises), where an attacker with physical access to a vulnerable system could exploit this vulnerability to gain elevated privileges. This flaw stems from improper access control in certain scenarios, allowing attackers to perform actions that would typically be restricted. Microsoft addressed this issue in their security update released in July 2019, effectively mitigating the risk. Users are advised to apply the recommended updates to enhance security and prevent potential exploitation. It is crucial for organizations to remain vigilant and keep their systems up-to-date to protect against known vulnerabilities.",A remote code execution vulnerability exists when the Windows Jet Database Engine improperly handles objects in memory. An attacker who successfully exploited this vulnerability could execute arbitrary code on a victim system. An attacker could exploit this vulnerability by enticing a victim to open a specially crafted file. The update addresses the vulnerability by correcting the way the Windows Jet Database Engine handles objects in memory.,0.8866958410665983,,0.8463930302075959,0.08893868599300615,0.21212121212121213
3,What is CVE-2019-1174,"CVE-2019-1174 is a vulnerability that affects the Microsoft Dynamics CRM and Dynamics 365 applications. It is classified as a security feature bypass that allows an attacker to manipulate URLs in order to access unauthorized content or information. The issue arises due to improper handling of user privileges during navigation, potentially exposing sensitive data. Microsoft addressed this vulnerability in its updates, advising users to apply the latest security patches to mitigate any risks associated with the exploit. It’s essential for organizations using these applications to stay informed about security updates to prevent any potential breaches.","An elevation of privilege vulnerability exists in the way that the PsmServiceExtHost.dll handles objects in memory. An attacker who successfully exploited the vulnerability could execute code with elevated permissions. To exploit the vulnerability, a locally authenticated attacker could run a specially crafted application. The security update addresses the vulnerability by ensuring the PsmServiceExtHost.dll properly handles objects in memory.",0.8801805979901286,0.40353677642117824,0.8141471056847128,0.03458592114102736,0.2
4,What is CVE-2019-1190,"CVE-2019-1190 is a vulnerability in Microsoft Exchange Server that affects Microsoft Exchange Server 2010, 2013, 2016, and 2019. It allows an attacker to perform remote code execution on the affected server due to improper handling of objects in memory. This vulnerability exploits the way Microsoft Exchange handles objects in memory, which could allow an attacker to execute arbitrary code within the context of the system account. Microsoft released security updates to address this vulnerability, emphasizing the importance of updating systems to mitigate potential exploitation. Users and organizations are advised to apply the patches provided by Microsoft promptly to secure their Exchange environments.","An elevation of privilege vulnerability exists in the way that the Windows kernel image handles objects in memory. An attacker who successfully exploited the vulnerability could execute code with elevated permissions. To exploit the vulnerability, a locally authenticated attacker could run a specially crafted application. The security update addresses the vulnerability by ensuring the Windows kernel image properly handles objects in memory.",0.9020584831597948,,0.8629109260148826,0.024623373672221803,0.3225806451612903
5,What is CVE-2019-19298,"CVE-2019-19298 is a vulnerability in the Apache Airflow project, specifically affecting versions prior to 1.10.10. This security flaw arises from improper input validation in the web interface, which could allow an authenticated user to execute arbitrary code on the server through crafted requests. This vulnerability is classified as a critical issue due to the potential for exploiting the system when proper security measures are not in place. Users are recommended to upgrade to version 1.10.10 or later to mitigate this risk, as the newer versions contain fixes addressing this vulnerability. As of the last update, further research and evaluations of the exploit's impact have been conducted to bolster security protocols around Apache Airflow.","A vulnerability has been identified in SiNVR/SiVMS Video Server (All versions = V5.0.0 < V5.0.2). The streaming service (default port 5410/tcp) of the SiVMS/SiNVR Video Server contains a input validation vulnerability, that could allow an unauthenticated remote attacker to cause a Denial-of-Service condition by sending malformed HTTP requests.",0.8957302676897186,0.20299746352265616,0.8118965008177486,0.033045998456689034,0.21818181818181817
6,What is CVE-2020-0761,"CVE-2020-0761 is a vulnerability in the Microsoft Dynamics 365 Business Central software that could allow an attacker to escalate privileges. This issue arises due to improper validation of input data when handling user requests. Exploitation of this vulnerability could enable an authenticated attacker to execute arbitrary code with higher privileges. Microsoft addressed this vulnerability in its security updates released in July 2020, urging users to apply the patches to mitigate potential risks. It's important for organizations to ensure they are running the latest versions to protect against such vulnerabilities.","A remote code execution vulnerability exists when Active Directory integrated DNS (ADIDNS) mishandles objects in memory. An authenticated attacker who successfully exploited the vulnerability could run arbitrary code in the context of the Local System Account To exploit the vulnerability, an authenticated attacker could send malicious requests to an Active Directory integrated DNS (ADIDNS) server. The update addresses the vulnerability by correcting how Active Directory integrated DNS (ADIDNS) handles objects in memory.",0.8709152075907265,0.6372657605486589,0.8348705996748025,0.04724932626401583,0.2222222222222222
7,What is CVE-2020-0908,"CVE-2020-0908 is a critical vulnerability in the Microsoft Remote Desktop Protocol (RDP) that affects various versions of the Microsoft Windows operating system. This vulnerability allows remote attackers to execute arbitrary code on the affected system, potentially leading to a complete system compromise. It exploits how the RDP handles connection requests, which could allow an attacker to execute malicious code without user interaction. Microsoft released security updates in May 2020 to address this vulnerability, and it is advised for users to apply these patches promptly to mitigate the associated risks. Organizations are also encouraged to implement network-level security measures, like disabling RDP services if not needed, to further protect against exploitation.","A remote code execution vulnerability exists when the Windows Text Service Module improperly handles memory. An attacker who successfully exploited the vulnerability could gain execution on a victim system. An attacker could host a specially crafted website that is designed to exploit the vulnerability through Microsoft Edge (Chromium-based), and then convince a user to view the website. The attacker could also take advantage of compromised websites and websites that accept or host user-provided content or advertisements by adding specially crafted content that could exploit the vulnerability. In all cases, however, an attacker would have no way to force users to view the attacker-controlled content. Instead, an attacker would have to convince users to take action, typically by way of enticement in an email or Instant Messenger message, or by getting them to open an attachment sent through email. The security update addresses the vulnerability by correcting how the Windows Text Service Module handles memory.",0.9341159001606165,,0.862607191247839,0.024440879746535214,0.15286624203821655
8,What is CVE-2020-1039,"CVE-2020-1039 is a security vulnerability affecting the Google Chrome browser, specifically identified as a use-after-free vulnerability in the PDFium component. It could allow an attacker to potentially exploit this flaw to execute arbitrary code in the context of the user’s browsing session. Google addressed this vulnerability in an update released in early June 2020 as part of a broader set of fixes aimed at enhancing the browser's security. Users were encouraged to update their Chrome installations to the latest version to mitigate the risk associated with this vulnerability.",A remote code execution vulnerability exists when the Windows Jet Database Engine improperly handles objects in memory. An attacker who successfully exploited this vulnerability could execute arbitrary code on a victim system. An attacker could exploit this vulnerability by enticing a victim to open a specially crafted file. The update addresses the vulnerability by correcting the way the Windows Jet Database Engine handles objects in memory.,0.9059414918291743,,0.812550756893842,0.025771688135729765,0.2727272727272727
9,What is CVE-2020-1167,"CVE-2020-1167 is a vulnerability in the Microsoft Dynamics 365 Customer Engagement application, specifically affecting the online version. This issue is classified as a security feature bypass, which could allow an attacker to perform certain actions without the necessary permissions. The vulnerability arises from improper validation of the requests made by the application, which could enable unauthorized actions or access to sensitive data. Microsoft addressed this vulnerability in an update released in July 2020, emphasizing the importance of applying security patches to mitigate potential exploitation. Users are encouraged to keep their software up to date to protect against such vulnerabilities.","A remote code execution vulnerability exists in the way that Microsoft Graphics Components handle objects in memory. An attacker who successfully exploited the vulnerability could execute arbitrary code on a target system. To exploit the vulnerability, a user would have to open a specially crafted file. The security update addresses the vulnerability by correcting how Microsoft Graphics Components handle objects in memory.",0.8800151596784004,,0.8546865994057558,0.05039518688486958,0.24193548387096775
10,What is CVE-2020-1252,"CVE-2020-1252 is a security vulnerability affecting the Windows kernel that could allow an attacker to execute arbitrary code in the context of the kernel, potentially leading to a complete system compromise. This vulnerability is particularly critical because it allows for elevation of privileges if successfully exploited. Microsoft addressed the issue as part of its July 2020 Patch Tuesday updates, and users are urged to ensure their systems are updated to protect against this vulnerability. The exploitability of CVE-2020-1252 in a real-world scenario was observed shortly after its disclosure, making it imperative for organizations to implement the recommended patches swiftly to mitigate risks.","A remote code execution vulnerability exists when Windows improperly handles objects in memory. To exploit the vulnerability an attacker would have to convince a user to run a specially crafted application. An attacker who successfully exploited this vulnerability could execute arbitrary code and take control of an affected system. An attacker could then install programs; view, change, or delete data; or create new accounts with full user rights. The updates address the vulnerability by correcting how Windows handles objects in memory.",0.9214098039787282,,0.8943024580985648,0.06918451692157555,0.18518518518518517
11,What is CVE-2020-1345,"CVE-2020-1345 is a security vulnerability that affects Microsoft Dynamics 365 and other related products. It is classified as a remote code execution vulnerability, which means that an attacker can execute arbitrary code on a target system if they successfully exploit the flaw. The vulnerability arises from improper handling of objects in memory, leading to potential exploitation through specially crafted requests. Microsoft issued patches and updates to mitigate this vulnerability, and users are advised to apply these updates promptly to protect their systems from potential threats. The vulnerability was notable for its ease of exploitation, highlighting the importance of maintaining up-to-date security measures in enterprise applications.","A cross-site-scripting (XSS) vulnerability exists when Microsoft SharePoint Server does not properly sanitize a specially crafted web request to an affected SharePoint server. An authenticated attacker could exploit the vulnerability by sending a specially crafted request to an affected SharePoint server. The attacker who successfully exploited the vulnerability could then perform cross-site scripting attacks on affected systems and run script in the security context of the current user. The attacks could allow the attacker to read content that the attacker is not authorized to read, use the victim's identity to take actions on the SharePoint site on behalf of the user, such as change permissions and delete content, and inject malicious content in the browser of the user. The security update addresses the vulnerability by helping to ensure that SharePoint Server properly sanitizes web requests.",0.8973605131879133,,,0.035105248275097665,0.16546762589928057
12,What is CVE-2020-1464,"CVE-2020-1464 is a vulnerability in the Windows operating system that involves a security feature bypass related to the handling of how Windows validates the trustworthiness of a signed file. Specifically, it affects the Microsoft Windows Kernel, allowing attackers to run arbitrary code in the context of a user account. This vulnerability can be exploited through various vectors, including malicious applications or specially crafted files. Microsoft addressed this issue in a security update released in September 2020, and it is classified as important due to the potential impact on system integrity and security. Users are encouraged to ensure their systems are updated to mitigate any potential risks associated with this vulnerability.","A spoofing vulnerability exists when Windows incorrectly validates file signatures. An attacker who successfully exploited this vulnerability could bypass security features and load improperly signed files. In an attack scenario, an attacker could bypass security features intended to prevent improperly signed files from being loaded. The update addresses the vulnerability by correcting how Windows validates file signatures.",0.9109231575548864,,0.9027743464561411,0.06032401726201459,0.2631578947368421
13,What is CVE-2020-1486,"CVE-2020-1486 is a security vulnerability that affects the Windows User Profile Service. It allows an authenticated attacker to execute arbitrary code in the context of the User Profile Service, which can lead to local privilege escalation. This vulnerability is a result of improper handling of certain file permissions, potentially enabling attackers to bypass security restrictions. Microsoft addressed this vulnerability in its updates released in July 2020, enhancing the file permissions and overall security of the User Profile Service to mitigate the risks associated with this flaw. As with many CVEs, it is critical for users and organizations to apply the relevant security patches promptly to protect their systems.","An elevation of privilege vulnerability exists when the Windows kernel fails to properly handle objects in memory. An attacker who successfully exploited this vulnerability could run arbitrary code in kernel mode. An attacker could then install programs; view, change, or delete data; or create new accounts with full user rights. To exploit this vulnerability, an attacker would first have to log on to the system. An attacker could then run a specially crafted application to take control of an affected system. The update addresses the vulnerability by correcting how the Windows kernel handles objects in memory.",0.8779343264252183,,,0.06754312828675707,0.19791666666666666
14,What is CVE-2020-1512,"CVE-2020-1512 is a vulnerability that affects the Windows Print Spooler service, allowing an attacker to execute arbitrary code with system privileges. This vulnerability is categorized as a local privilege escalation issue, meaning that it requires local access to the vulnerable system, making it particularly dangerous in environments where users have elevated permissions. The flaw was identified in Microsoft's Windows 10 and Windows Server editions and has been assigned a CVSS score of 7.8, indicating its severity. Microsoft released patches to address this vulnerability in the security updates of July 2020. It is crucial for organizations to apply these updates promptly to mitigate the risk of exploitation.",An information disclosure vulnerability exists when the Windows State Repository Service improperly handles objects in memory. An attacker who successfully exploited this vulnerability could obtain information to further compromise the user’s system. An attacker could exploit this vulnerability by running a specially crafted application on the victim system. The update addresses the vulnerability by correcting the way the Windows State Repository Service handles objects in memory.,0.9229629245371295,,,0.043038462665890835,0.26865671641791045
15,What is CVE-2020-1523,"CVE-2020-1523 is a vulnerability in the Cisco Adaptive Security Appliance (ASA) and Cisco Firepower Threat Defense (FTD) platforms. This vulnerability is categorized as a denial-of-service (DoS) flaw, which could allow an unauthenticated, remote attacker to cause the affected device to reload. The issue arises due to improper handling of certain ICMP packets. Cisco released patches to address the vulnerability, and users were urged to update their systems to mitigate potential exploitation risks. The vulnerability affects multiple versions of Cisco ASA and FTD software, and it is important for network administrators to review their systems for exposure.","A tampering vulnerability exists when Microsoft SharePoint Server fails to properly handle profile data. An attacker who successfully exploited this vulnerability could modify a targeted user's profile data. To exploit the vulnerability, an attacker would need to be authenticated on an affected SharePoint Server. The attacker would then need to send a specially modified request to the server, targeting a specific user. The security update addresses the vulnerability by modifying how Microsoft SharePoint Server handles profile data.",0.8735628381347483,0.9498468012845649,0.7992951168755404,0.020705706652424008,0.21794871794871795
16,What is CVE-2020-1533,"CVE-2020-1533 is a vulnerability found in the Microsoft Windows Codecs Library, specifically affecting the handling of certain image file formats. It allows an attacker to execute arbitrary code in the context of the current user if a maliciously crafted image file is opened. This vulnerability is particularly dangerous as it could lead to remote code execution, enabling attackers to install programs, view or delete data, or create new accounts with full user rights. Microsoft addressed this issue in updates released in July 2020 as part of their regular patch cycle, urging users to apply the updates to mitigate the risk. As of October 2023, there have been no significant new discoveries or exploits related to CVE-2020-1533, but users are still advised to maintain updated systems to ensure security against various vulnerabilities.","An elevation of privilege vulnerability exists in the way that the Windows WalletService handles objects in memory. An attacker who successfully exploited the vulnerability could execute code with elevated permissions. To exploit the vulnerability, a locally authenticated attacker could run a specially crafted application. The security update addresses the vulnerability by ensuring the Windows WalletService properly handles objects in memory.",0.909406216173979,0.2062190980750947,0.8248763923003788,0.046574698071706964,0.2833333333333333
